{
  "schema_version": "1.0",
  "phase": "MASTER_VALIDATION_P6_TARGET_PROFILE",
  "target_runtime": "windows-target",
  "project_path": ".aledevos/state/release/master/targets/p6-real-project",
  "task_id": "P6-REAL-001",
  "run_id": "P6-RUN-001",
  "adapter": "opencode",
  "artifacts": {
    "user_request": null,
    "task_contract": null,
    "context_handoff": null,
    "orchestration_trace": null,
    "skill_route": null,
    "skill_composition": null,
    "skill_load": null,
    "skill_execution_handoff": null,
    "skill_governance": null,
    "skill_execution_receipt": null,
    "model_binding": null,
    "model_route": null,
    "worktree_receipt": null,
    "worker_assignment": null,
    "worker_session": null,
    "worker_handoff": null,
    "dispatcher_queue": null,
    "dispatcher_started_receipt": null,
    "phase2_receipt": null,
    "phase4_report": null,
    "visual_acceptance": null,
    "primary_judge_evidence": null,
    "secondary_judge_evidence": null,
    "judge_comparison": null,
    "diversity_decision": null,
    "global_state": null,
    "telemetry_summary": null
  }
}
